Section,Question ID,Question,Answer (Value),Answer (Label),Reasoning
Category Screening,M8_q01,How often do you personally use body wash or shower gel?,daily,Daily,"Real evidence states the participant showers once daily, so body wash use is daily."
Category Screening,M8_q02,Which body wash or shower gel brands have you used in the past 3 months? Select all that apply.,"[""dove"", ""pears"", ""lux"", ""body_shop"", ""other""]",Dove; Pears; Lux; The Body Shop; Other brand,"Real and synthetic evidence shows recent use of Dove, Pears, Bath & Body Works (counted as Other brand), Lux, and The Body Shop; Olay, Nivea, Johnson's, Fiama not mentioned as recently used."
Category Screening,M8_q03,"Overall, how satisfied are you with the body wash or shower gel you currently use most often?",somewhat_satisfied,Somewhat satisfied,"Participant expressed some frustration with scent and skin feeling post-wash but overall clean enough, indicating moderate satisfaction."
Category Screening,M8_q04,"What, if anything, would you most like to see improved in body wash or shower gel products?","I would like body washes to improve moisturizing without making skin feel greasy, especially for oily, acne-prone skin. Also, clearer ingredient lists and clinically proven actives would help me trust the product more.","I would like body washes to improve moisturizing without making skin feel greasy, especially for oily, acne-prone skin. Also, clearer ingredient lists and clinically proven actives would help me trust the product more.","Evidence shows preference for moisturized skin feeling post-wash without dryness, plus a strong focus on ingredient transparency and clinical backing."
Concept 1: Dove 60-Second Body Spray,M8_q05,"Overall, how interested are you in this product concept?",3,3 (Moderately interested),Prior answers show moderate interest (3/5) in Dove 60-Second Body Spray due to its quick cleanse promise but skepticism about claims and price.
Concept 1: Dove 60-Second Body Spray,M8_q06,"What, if anything, did you find most appealing about the Dove 60-Second Body Spray concept?","The most appealing part is the promise of a quick, effective cleanse in just 60 seconds using micellar technology, which sounds like a good solution for busy days when I have limited time.","The most appealing part is the promise of a quick, effective cleanse in just 60 seconds using micellar technology, which sounds like a good solution for busy days when I have limited time.","The concept's speed and micellar cleansing technology align with the twin's desire for efficient, clinically backed products for oily skin."
Concept 1: Dove 60-Second Body Spray,M8_q07,"What, if anything, would you change or improve about the Dove 60-Second Body Spray concept?","I would want clearer information on the ingredients and clinical studies proving the 60-second claim. Also, reassurance about skin safety and non-irritation would improve trust.","I would want clearer information on the ingredients and clinical studies proving the 60-second claim. Also, reassurance about skin safety and non-irritation would improve trust.",The twin is a claims-first analytical scrutinizer who demands ingredient and clinical proof before purchase and worries about skin irritation.
Concept 1: Dove 60-Second Body Spray,M8_q08,How well does the Dove 60-Second Body Spray concept fit with your current routine?,3,3 (Somewhat well),"The concept fits somewhat well with the routine as per prior answers, given the need for quick cleansing but not fully integrated yet."
Concept 1: Dove 60-Second Body Spray,M8_q09,How likely would the Dove 60-Second Body Spray be to save you time in your routine?,3,3 (Moderately likely),"Moderate likelihood to save time aligns with prior 'somewhat' relevance and interest, reflecting cautious optimism about the 60-second claim."
Concept 1: Dove 60-Second Body Spray,M8_q10,"Based on what you've seen, how likely would you be to buy the Dove 60-Second Body Spray?",might_buy,Might or might not buy,"Participant values clinical backing and ingredient proof; while the 60-second body spray claims micellar tech, the speed claim may be interesting but not fully convincing without deeper proof."
Concept 1: Dove 60-Second Body Spray,M8_q12,How unique or different is the Dove 60-Second Body Spray compared to other body wash products available today?,somewhat,Somewhat unique,Micellar cleansing in body wash is somewhat unique but not revolutionary; participant is analytical and would see this as a modest innovation.
Concept 1: Dove 60-Second Body Spray,M8_q13,How relevant is the Dove 60-Second Body Spray to your personal needs?,somewhat,Somewhat relevant,The product targets quick cleaning between activities which may be somewhat relevant but participant showers once daily and prefers thorough cleansing.
Concept 1: Dove 60-Second Body Spray,M8_q14,How believable are the claims made about the Dove 60-Second Body Spray?,somewhat,Somewhat believable,Claims about micellar technology and 60-second cleaning sound plausible but participant would reserve full belief until seeing clinical data.
Concept 1: Dove 60-Second Body Spray,M8_q15,How well does the Dove 60-Second Body Spray idea fit with what you expect from the Dove brand?,somewhat,Fits somewhat well,"Dove is a familiar brand used by participant, so the product fits Dove's image somewhat, but the new format is a bit different from usual body wash expectations."
Concept 1: Dove 60-Second Body Spray,M8_q16,How would you describe the Dove 60-Second Body Spray? Rate each pair of characteristics.,"{""Basic-Premium"": 4, ""Boring-Exciting"": 3, ""Not for me-Made for me"": 3, ""Old-fashioned-Innovative"": 4, ""Forgettable-Memorable"": 3}",Basic-Premium: 4; Boring-Exciting: 3; Not for me-Made for me: 3; Old-fashioned-Innovative: 4; Forgettable-Memorable: 3,"The Dove 60-Second Body Spray is seen as somewhat innovative and slightly premium due to micellar technology, but overall fits moderately with current needs and is not highly exciting or memorable."
Concept 1: Dove 60-Second Body Spray,M8_q19,"What concerns, if any, would you have about trying the Dove 60-Second Body Spray? Select all that apply.","[""price_high"", ""skeptical_claims"", ""skin_irritation"", ""availability"", ""happy_current""]",Price might be too high; Might not work as claimed; Could irritate my skin; Might not be available where I shop; Happy with current product,"Participant is somewhat satisfied with current products, skeptical of new claims, price sensitivity at Rs.199-399 noted, and cautious about irritation and availability."
Concept 2: Dove Skip,M8_q20,"Overall, how interested are you in this product concept?",4,4,"Prior answers indicate strong appeal (4/5) for Dove Skip due to its 12-hour moisturization promise, fitting well with the need to skip lotion."
Concept 2: Dove Skip,M8_q21,"What, if anything, did you find most appealing about the Dove Skip concept?",The idea of 12-hour moisturization straight from the shower is very appealing since I often skip lotion. The advanced lipid-lock technology sounds promising if it truly seals hydration without greasiness.,The idea of 12-hour moisturization straight from the shower is very appealing since I often skip lotion. The advanced lipid-lock technology sounds promising if it truly seals hydration without greasiness.,"The twin values moisturization post-wash and convenience, so a product eliminating lotion step with proven tech is attractive."
Concept 2: Dove Skip,M8_q22,"What, if anything, would you change or improve about the Dove Skip concept?","I would want more clinical evidence on how well the lipid-lock technology works, especially for oily, acne-prone skin. Also, a non-greasy texture and clear ingredient list would improve the concept.","I would want more clinical evidence on how well the lipid-lock technology works, especially for oily, acne-prone skin. Also, a non-greasy texture and clear ingredient list would improve the concept.",Skepticism about claims and skin irritation concerns require clinical proof and texture suitability for oily skin.
Concept 2: Dove Skip,M8_q23,How well does the Dove Skip concept fit with your current routine?,3,3 (Somewhat well),Fits somewhat well with current routine as moisturizing after shower is desired but product needs clinical proof and non-greasy texture.
Concept 2: Dove Skip,M8_q24,How likely would the Dove Skip be to save you time in your routine?,4,4,"Likely to save time moderately to highly since it eliminates lotion step, consistent with prior interest and time-saving appeal."
Concept 2: Dove Skip,M8_q25,"Based on what you've seen, how likely would you be to buy the Dove Skip?",probably_buy,Probably would buy,"Participant prioritizes moisturized post-wash skin and would be attracted to 12-hour moisturization claims, though price is premium; likely to consider buying if clinical backing is credible."
Concept 2: Dove Skip,M8_q27,How unique or different is the Dove Skip compared to other body wash products available today?,somewhat,Somewhat unique,"Similar to Dove 60-Second Body Spray, this product's moisturizing claim is somewhat unique but not radically different from other body washes with moisturizing benefits."
Concept 2: Dove Skip,M8_q28,How relevant is the Dove Skip to your personal needs?,somewhat,Somewhat relevant,"The twin values moisturization post-shower but is somewhat ambivalent since he sometimes skips lotion due to hassle; thus, relevance is moderate."
Concept 2: Dove Skip,M8_q29,How believable are the claims made about the Dove Skip?,somewhat,Somewhat believable,The twin tends to be skeptical but open to clinical claims; 'advanced lipid-lock technology' sounds plausible but would require ingredient and clinical backing to be fully believable.
Concept 2: Dove Skip,M8_q30,How well does the Dove Skip idea fit with what you expect from the Dove brand?,somewhat,Fits somewhat well,"The product fits the Dove brand's moisturizing positioning somewhat well, consistent with prior answers about Dove fitting somewhat well."
Concept 2: Dove Skip,M8_q31,How would you describe the Dove Skip? Rate each pair of characteristics.,"{""Basic-Premium"": 4, ""Boring-Exciting"": 3, ""Not for me-Made for me"": 4, ""Old-fashioned-Innovative"": 4, ""Forgettable-Memorable"": 3}",Basic-Premium: 4; Boring-Exciting: 3; Not for me-Made for me: 4; Old-fashioned-Innovative: 4; Forgettable-Memorable: 3,"Dove Skip's advanced lipid-lock technology and 12-hour moisturization appeal as innovative and somewhat premium, fitting personal needs moderately but not strongly exciting or memorable."
Concept 2: Dove Skip,M8_q34,"What concerns, if any, would you have about trying the Dove Skip? Select all that apply.","[""price_high"", ""skeptical_claims"", ""skin_irritation""]",Price might be too high; Might not work as claimed; Could irritate my skin,"Given the premium price (Rs.349-599) and the moisturizing claim, participant would be concerned about efficacy and irritation, consistent with clinical ingredient focus and price sensitivity."
Concept 3: Dove Night Wash,M8_q35,"Overall, how interested are you in this product concept?",3,3 (Moderately interested),"Moderate interest in Dove Night Wash due to calming claims and clinical oils, but price and proof concerns temper enthusiasm."
Concept 3: Dove Night Wash,M8_q36,"What, if anything, did you find most appealing about the Dove Night Wash concept?","The calming ritual with clinically shown chamomile and lavender oils is appealing, especially if it genuinely helps reduce stress hormones and creates a richer lather for relaxation.","The calming ritual with clinically shown chamomile and lavender oils is appealing, especially if it genuinely helps reduce stress hormones and creates a richer lather for relaxation.","The twin appreciates clinical backing and multi-benefit products that enhance comfort and confidence, fitting the night wash concept."
Concept 3: Dove Night Wash,M8_q37,"What, if anything, would you change or improve about the Dove Night Wash concept?","I would want clearer proof of the stress-reducing claims and assurance that the fragrance won't irritate my skin. Also, the price feels a bit high for a body wash, so value for money is important.","I would want clearer proof of the stress-reducing claims and assurance that the fragrance won't irritate my skin. Also, the price feels a bit high for a body wash, so value for money is important.",Price sensitivity and skepticism about claims are consistent concerns; clinical evidence and skin safety are needed.
Concept 3: Dove Night Wash,M8_q38,How well does the Dove Night Wash concept fit with your current routine?,3,3 (Somewhat well),Fits somewhat well with routine as night shower ritual is appealing but requires clearer proof and skin safety assurances.
Concept 3: Dove Night Wash,M8_q40,"Based on what you've seen, how likely would you be to buy the Dove Night Wash?",might_buy,Might or might not buy,"The twin is interested in clinical benefits but less motivated by sensory or ritualistic claims; thus, likelihood to buy is moderate."
Concept 3: Dove Night Wash,M8_q42,How unique or different is the Dove Night Wash compared to other body wash products available today?,somewhat,Somewhat unique,The calming ritual and slow-release lavender oils are somewhat unique but not radically different from other body washes with calming claims.
Concept 3: Dove Night Wash,M8_q43,How relevant is the Dove Night Wash to your personal needs?,somewhat,Somewhat relevant,The twin values skin benefits over sensory experience; calming claims are somewhat relevant but not a top priority.
Concept 3: Dove Night Wash,M8_q44,How believable are the claims made about the Dove Night Wash?,somewhat,Somewhat believable,"Clinical claims about chamomile and lavender reducing stress hormones sound plausible but would require clinical proof; thus, somewhat believable."
Concept 3: Dove Night Wash,M8_q45,How well does the Dove Night Wash idea fit with what you expect from the Dove brand?,somewhat,Fits somewhat well,"Prior answers rate Dove Night Wash as somewhat fitting Dove's brand and somewhat relevant; the calming, clinical claim fits Dove's mild skincare positioning but not extremely aspirational."
Concept 3: Dove Night Wash,M8_q46,How would you describe the Dove Night Wash? Rate each pair of characteristics.,"{""Basic-Premium"": 3, ""Boring-Exciting"": 3, ""Not for me-Made for me"": 3, ""Old-fashioned-Innovative"": 3, ""Forgettable-Memorable"": 3}",Basic-Premium: 3; Boring-Exciting: 3; Not for me-Made for me: 3; Old-fashioned-Innovative: 3; Forgettable-Memorable: 3,"Dove Night Wash is somewhat unique but fits moderately with routine and expectations, leading to neutral ratings across all dimensions."
Concept 3: Dove Night Wash,M8_q49,"What concerns, if any, would you have about trying the Dove Night Wash? Select all that apply.","[""price_high"", ""skeptical_claims"", ""skin_irritation""]",Price might be too high; Might not work as claimed; Could irritate my skin,"Despite interest in calming benefits, participant is cautious about price (Rs.299-499) and clinical proof, plus skin irritation risk."
Concept 4: Dove Yours & Mine,M8_q50,"Overall, how interested are you in this product concept?",3,3 (Moderately interested),Prior answers show moderate interest in Dove Yours & Mine due to appealing personalized fragrance quiz but concerns about high price and potential skin irritation.
Concept 4: Dove Yours & Mine,M8_q51,"What, if anything, did you find most appealing about the Dove Yours & Mine concept?","The personalized fragrance quiz and the idea of carrying a subtle scent that connects partners is interesting, but the high price and potential skin irritation make me cautious.","The personalized fragrance quiz and the idea of carrying a subtle scent that connects partners is interesting, but the high price and potential skin irritation make me cautious.","While the twin finds the concept emotionally appealing, price and skin safety concerns limit enthusiasm."
Concept 4: Dove Yours & Mine,M8_q52,"What, if anything, would you change or improve about the Dove Yours & Mine concept?","I would reduce the price from ₹799/₹999 as it feels high for a body wash kit. Also, clearer ingredient information and assurance about skin safety would help, since potential irritation is a concern.","I would reduce the price from ₹799/₹999 as it feels high for a body wash kit. Also, clearer ingredient information and assurance about skin safety would help, since potential irritation is a concern.","Based on prior answers, the personalized fragrance quiz is appealing but price and skin irritation concerns make me cautious."
Concept 4: Dove Yours & Mine,M8_q55,"Based on what you've seen, how likely would you be to buy the Dove Yours & Mine?",might_buy,Might or might not buy,This twin is fragrance-ambivalent and values clinical efficacy over scent personalization; a premium couples kit at ₹799 is somewhat interesting but not strongly compelling.
Concept 4: Dove Yours & Mine,M8_q57,How unique or different is the Dove Yours & Mine compared to other body wash products available today?,somewhat,Somewhat unique,"Similar to Dove 60-Second Body Spray and Dove Night Wash, this concept is seen as somewhat unique but not groundbreaking, based on personalization and scent focus."
Concept 4: Dove Yours & Mine,M8_q58,How relevant is the Dove Yours & Mine to your personal needs?,somewhat,Somewhat relevant,The product's emotional benefit of closeness is somewhat relevant but not a primary need for this twin who prioritizes skin benefits and ingredient efficacy.
Concept 4: Dove Yours & Mine,M8_q59,How believable are the claims made about the Dove Yours & Mine?,somewhat,Somewhat believable,Claims about personalized fragrance formulas are plausible but not clinically backed; this twin is skeptical without clinical proof.
Concept 4: Dove Yours & Mine,M8_q60,How well does the Dove Yours & Mine idea fit with what you expect from the Dove brand?,somewhat,Fits somewhat well,"The concept aligns moderately with Dove's brand, which balances mild skincare and approachable innovation, but the strong fragrance personalization is not core to Dove's typical positioning."
Concept 4: Dove Yours & Mine,M8_q61,How would you describe the Dove Yours & Mine? Rate each pair of characteristics.,"{""Basic-Premium"": 3, ""Boring-Exciting"": 3, ""Not for me-Made for me"": 3, ""Old-fashioned-Innovative"": 3, ""Forgettable-Memorable"": 3}",Basic-Premium: 3; Boring-Exciting: 3; Not for me-Made for me: 3; Old-fashioned-Innovative: 3; Forgettable-Memorable: 3,Dove Yours & Mine concept is interesting but price and potential irritation concerns keep ratings neutral across all characteristics.
Concept 4: Dove Yours & Mine,M8_q64,"What concerns, if any, would you have about trying the Dove Yours & Mine? Select all that apply.","[""price_high"", ""skeptical_claims"", ""skin_irritation"", ""availability""]",Price might be too high; Might not work as claimed; Could irritate my skin; Might not be available where I shop,"High price (Rs.799-999) and personalized fragrance concept raise concerns about efficacy, irritation, and availability."
Concept 5: Dove Skin ID,M8_q65,"Overall, how interested are you in this product concept?",4,4,"Evidence indicates strong appeal for Dove Skin ID's AI customization for oily, acne-prone skin, with moderate-to-high interest despite price concerns."
Concept 5: Dove Skin ID,M8_q66,"What, if anything, did you find most appealing about the Dove Skin ID concept?","The AI skin analysis combined with a customized body wash for different skin areas is very appealing, especially since it targets my oily, acne-prone skin needs specifically.","The AI skin analysis combined with a customized body wash for different skin areas is very appealing, especially since it targets my oily, acne-prone skin needs specifically.","I find the Dove Skin ID concept very unique and highly relevant, with AI personalization being a strong attractor despite some price concerns."
Concept 5: Dove Skin ID,M8_q67,"What, if anything, would you change or improve about the Dove Skin ID concept?","I would want more transparency on ingredient lists and clinical proof that the AI customization actually improves skin health. Also, a lower price point or subscription discount would make it more accessible.","I would want more transparency on ingredient lists and clinical proof that the AI customization actually improves skin health. Also, a lower price point or subscription discount would make it more accessible.","Concerns about price, trust in claims, and skin irritation were noted; clearer proof and affordability improvements align with my cautious, research-first approach."
Concept 5: Dove Skin ID,M8_q68,How well does the Dove Skin ID concept fit with your current routine?,3,3 (Somewhat well),"Fits somewhat well with current routine as the concept targets specific skin needs, but price and trust issues moderate full integration."
Concept 5: Dove Skin ID,M8_q70,"Based on what you've seen, how likely would you be to buy the Dove Skin ID?",probably_buy,Probably would buy,"AI skin analysis is interesting and relevant for this twin's oily, acne-prone skin; the ₹699 price is steep but acceptable if product efficacy is proven."
Concept 5: Dove Skin ID,M8_q72,How unique or different is the Dove Skin ID compared to other body wash products available today?,very,Very unique,"AI-customized body wash based on skin photos is a novel concept in this category, standing out from typical body washes, matching the twin's interest in clinical, targeted solutions."
Concept 5: Dove Skin ID,M8_q73,How relevant is the Dove Skin ID to your personal needs?,very,Very relevant,"The Dove Skin ID concept was rated as very unique and relevant in prior answers, and the twin values customized, clinically backed solutions for oily, acne-prone skin, making this concept highly relevant but not 'extremely' due to price and need for proven efficacy."
Concept 5: Dove Skin ID,M8_q74,How believable are the claims made about the Dove Skin ID?,somewhat,Somewhat believable,"Previous responses show cautious optimism about AI skin analysis features—finding them interesting but requiring the product itself to work first, so claims are somewhat believable but not fully trusted without clinical proof."
Concept 5: Dove Skin ID,M8_q75,How well does the Dove Skin ID idea fit with what you expect from the Dove brand?,somewhat,Fits somewhat well,"The Dove Skin ID fits somewhat well with the Dove brand as per earlier answers, aligning with Dove's reputation but the tech-driven, premium personalized approach is somewhat new for the brand."
Concept 5: Dove Skin ID,M8_q76,How would you describe the Dove Skin ID? Rate each pair of characteristics.,"{""Basic-Premium"": 5, ""Boring-Exciting"": 4, ""Not for me-Made for me"": 5, ""Old-fashioned-Innovative"": 5, ""Forgettable-Memorable"": 4}",Basic-Premium: 5; Boring-Exciting: 4; Not for me-Made for me: 5; Old-fashioned-Innovative: 5; Forgettable-Memorable: 4,"Dove Skin ID is rated very unique, highly relevant, and appealing due to AI customization and clinical targeting of oily, acne-prone skin, making it premium, innovative, and well-fitted."
Concept 5: Dove Skin ID,M8_q79,"What concerns, if any, would you have about trying the Dove Skin ID? Select all that apply.","[""price_high"", ""skeptical_claims"", ""skin_irritation"", ""distrust_new""]",Price might be too high; Might not work as claimed; Could irritate my skin; Don't trust new products,"Participant values clinical backing but is cautious about a new brand at Rs.699, concerned about irritation and skeptical of unproven AI tech."
Comparative & Pricing,M8_q17,How important are each of these factors when choosing a body wash?,"{""Cleansing effectiveness"": 5, ""Moisturization / skin hydration"": 5, ""Fragrance / scent quality"": 3, ""Gentleness on skin"": 4, ""Value for money"": 5, ""Innovation / uniqueness"": 4, ""Brand trust and reputation"": 4, ""Convenience / ease of use"": 3}",Cleansing effectiveness: 5; Moisturization / skin hydration: 5; Fragrance / scent quality: 3; Gentleness on skin: 4; Value for money: 5; Innovation / uniqueness: 4; Brand trust and reputation: 4; Convenience / ease of use: 3,"Evidence shows cleansing and moisturization are top priorities, fragrance is less important, gentleness and value matter strongly, with moderate importance to innovation, brand trust, and convenience."
Comparative & Pricing,M8_q80,"Now that you've seen all 5 concepts, please rank them from most to least appealing. Pick your top 3.","[""Dove Skip"", ""Dove Skin ID"", ""Dove 60-Second Body Spray"", ""Dove Night Wash"", ""Dove Yours & Mine""]",Dove Skip > Dove Skin ID > Dove 60-Second Body Spray > Dove Night Wash > Dove Yours & Mine,"Based on prior answers, Dove Skip and Dove Skin ID received higher interest and appeal due to clinical claims and multi-benefit value, followed by the 60-Second Body Spray for its innovation but with reservations; Night Wash and Yours & Mine were less preferred due to price and skin irritation concerns."
Comparative & Pricing,M8_q81,"Thinking about the concept you found most appealing — at the price shown, how likely would you be to buy it?",probably_buy,Probably would buy,"Consistent with prior answers showing moderate purchase intent for Dove Skin ID at ₹699, reflecting interest tempered by price sensitivity and need for proven efficacy."
Comparative & Pricing,M8_q82,What would you expect to pay for your most preferred concept? (Enter amount in rupees),350,350,"The participant typically spends ₹350–500 on body wash purchases and prefers mid-range pricing for clinically backed products; ₹350 aligns with the lower end of this range, reflecting a moderate price expectation for the preferred Dove Skip concept."
