Section,Question ID,Question,Answer (Value),Answer (Label),Reasoning
Category Screening,M8_q01,How often do you personally use body wash or shower gel?,daily,Daily,Real interview evidence states the participant showers once daily and uses body wash only.
Category Screening,M8_q02,Which body wash or shower gel brands have you used in the past 3 months? Select all that apply.,"[""dove"", ""pears"", ""lux"", ""other""]",Dove; Pears; Lux; Other brand,"Real evidence shows recent use of Dove, Pears, and Bath & Body Works (mapped here as 'Other brand'); Lux is named off the top of mind and likely tried recently given low brand loyalty."
Category Screening,M8_q03,"Overall, how satisfied are you with the body wash or shower gel you currently use most often?",somewhat_satisfied,Somewhat satisfied,Participant expressed some dissatisfaction with current body wash scents and skin feel but overall finds them clean enough.
Category Screening,M8_q04,"What, if anything, would you most like to see improved in body wash or shower gel products?","I want body washes with better fragrance options that smell premium and masculine, plus formulations that actually improve skin feel after use, not just clean but nourish. Also, easier availability in stores I frequent like Nykaa and Blinkit matters.","I want body washes with better fragrance options that smell premium and masculine, plus formulations that actually improve skin feel after use, not just clean but nourish. Also, easier availability in stores I frequent like Nykaa and Blinkit matters.","Evidence shows dissatisfaction with current scents (utensil cleanser smell) and desire for skin benefits beyond cleanliness, plus preference for premium, masculine fragrances and convenient purchase channels."
Concept 1: Dove 60-Second Body Spray,M8_q05,"Overall, how interested are you in this product concept?",5,5 (Extremely interested),"The twin expressed strong appeal for the Dove 60-Second Body Spray concept and gave it a 'probably buy' likelihood, indicating extremely high interest."
Concept 1: Dove 60-Second Body Spray,M8_q06,"What, if anything, did you find most appealing about the Dove 60-Second Body Spray concept?","The most appealing part is the promise of getting completely clean in just 60 seconds, which fits my busy lifestyle and need for quick, effective cleansing without scrubbing.","The most appealing part is the promise of getting completely clean in just 60 seconds, which fits my busy lifestyle and need for quick, effective cleansing without scrubbing.","Direct evidence highlights appreciation for the speed and effectiveness claims of the Dove 60-Second Body Spray concept, matching my impulse-curious quick decider trait."
Concept 1: Dove 60-Second Body Spray,M8_q07,"What, if anything, would you change or improve about the Dove 60-Second Body Spray concept?","I would want clearer proof or clinical validation of the 60-second cleaning claim and assurance that it actually works on Indian men's skin. Also, availability in my usual stores and a slightly lower price would help.","I would want clearer proof or clinical validation of the 60-second cleaning claim and assurance that it actually works on Indian men's skin. Also, availability in my usual stores and a slightly lower price would help.","Concerns about skeptical claims, price, and availability were noted; as an expert-recommendation seeker, I want credible proof and convenient access."
Concept 1: Dove 60-Second Body Spray,M8_q08,How well does the Dove 60-Second Body Spray concept fit with your current routine?,5,5 (Extremely well),"The concept fits very well with the twin's busy lifestyle and need for quick, effective cleansing, as supported by previous answers rating it 'very' relevant and fitting 'very well' with routine."
Concept 1: Dove 60-Second Body Spray,M8_q09,How likely would the Dove 60-Second Body Spray be to save you time in your routine?,5,5 (Extremely likely),"The twin specifically noted the time-saving benefit of the 60-second cleaning claim as highly appealing, indicating it would be extremely likely to save time."
Concept 1: Dove 60-Second Body Spray,M8_q10,"Based on what you've seen, how likely would you be to buy the Dove 60-Second Body Spray?",probably_buy,Probably would buy,"The Dove 60-Second Body Spray’s speed and micellar technology appeal to the participant’s need for quick, effective cleansing, though some verification would be needed before a definite purchase."
Concept 1: Dove 60-Second Body Spray,M8_q12,How unique or different is the Dove 60-Second Body Spray compared to other body wash products available today?,very,Very unique,"The 60-second cleansing concept with micellar technology is perceived as quite different from typical body washes, aligning with participant’s interest in innovative products."
Concept 1: Dove 60-Second Body Spray,M8_q13,How relevant is the Dove 60-Second Body Spray to your personal needs?,very,Very relevant,"The product’s promise of fast, effective cleansing fits well with the participant’s lifestyle of squeezing showers between activities like gym and work."
Concept 1: Dove 60-Second Body Spray,M8_q14,How believable are the claims made about the Dove 60-Second Body Spray?,very,Very believable,"Participant trusts clinical and proven claims, and Dove’s micellar technology from face care lends credibility, though full belief requires some verification."
Concept 1: Dove 60-Second Body Spray,M8_q15,How well does the Dove 60-Second Body Spray idea fit with what you expect from the Dove brand?,very,Fits very well,"Dove’s positioning as a clinically trusted brand fits well with participant’s expectations for effective, skin-friendly body wash products."
Concept 1: Dove 60-Second Body Spray,M8_q16,How would you describe the Dove 60-Second Body Spray? Rate each pair of characteristics.,"{""Basic-Premium"": 4, ""Boring-Exciting"": 4, ""Not for me-Made for me"": 5, ""Old-fashioned-Innovative"": 5, ""Forgettable-Memorable"": 4}",Basic-Premium: 4; Boring-Exciting: 4; Not for me-Made for me: 5; Old-fashioned-Innovative: 5; Forgettable-Memorable: 4,"Participant finds the Dove 60-Second Body Spray very unique, innovative, and fitting for his busy lifestyle, indicating a strong positive rating on innovation and personal relevance."
Concept 1: Dove 60-Second Body Spray,M8_q19,"What concerns, if any, would you have about trying the Dove 60-Second Body Spray? Select all that apply.","[""skeptical_claims"", ""price_high"", ""availability""]",Might not work as claimed; Price might be too high; Might not be available where I shop,"The twin is intrigued by Dove 60-Second Body Spray and likely to buy but has concerns about product efficacy, price at Rs.199-399, and availability given usual shopping at Blinkit and local stores."
Concept 2: Dove Skip,M8_q20,"Overall, how interested are you in this product concept?",5,5 (Extremely interested),The twin liked the Dove Skip concept for solving the hassle of moisturizing after showering and rated their interest and relevance as very high.
Concept 2: Dove Skip,M8_q21,"What, if anything, did you find most appealing about the Dove Skip concept?","I like that it solves a real hassle by moisturizing skin during the shower, saving time and effort, which fits my busy routine and desire for effective, no-extra-step grooming.","I like that it solves a real hassle by moisturizing skin during the shower, saving time and effort, which fits my busy routine and desire for effective, no-extra-step grooming.","The advanced lipid-lock technology and 12-hour moisturization appeal to my taste-conscious, aspirational self who wants efficient, premium-feeling products."
Concept 2: Dove Skip,M8_q22,"What, if anything, would you change or improve about the Dove Skip concept?","I would want more information on the ingredients and clinical backing to trust the moisturizing claims, and perhaps a more masculine scent profile to match my preferences.","I would want more information on the ingredients and clinical backing to trust the moisturizing claims, and perhaps a more masculine scent profile to match my preferences.",Skepticism about claims and preference for masculine framing suggest I need credible proof and aspirational fragrance cues.
Concept 2: Dove Skip,M8_q23,How well does the Dove Skip concept fit with your current routine?,5,5 (Extremely well),"The twin's routine benefits from a product that moisturizes during the shower, fitting extremely well with their busy grooming habits."
Concept 2: Dove Skip,M8_q24,How likely would the Dove Skip be to save you time in your routine?,5,5 (Extremely likely),The twin values time-saving solutions and sees Dove Skip as a product that would save significant time in their routine.
Concept 2: Dove Skip,M8_q25,"Based on what you've seen, how likely would you be to buy the Dove Skip?",probably_buy,Probably would buy,"The Dove Skip’s 12-hour moisturization directly addresses participant’s desire for moisturized skin post-wash and convenience, making it appealing though price is mid-premium."
Concept 2: Dove Skip,M8_q27,How unique or different is the Dove Skip compared to other body wash products available today?,very,Very unique,"The concept of Dove Skip with advanced lipid-lock technology offering 12-hour moisturization straight from the shower is novel compared to typical body washes, aligning with the twin's appreciation for clinically proven benefits and innovation."
Concept 2: Dove Skip,M8_q28,How relevant is the Dove Skip to your personal needs?,very,Very relevant,"The twin values moisturized skin post-shower and dislikes skipping lotion due to hassle, making this product highly relevant to their personal needs as indicated in prior answers emphasizing moisturization."
Concept 2: Dove Skip,M8_q29,How believable are the claims made about the Dove Skip?,very,Very believable,"The twin rates Dove claims as very believable and trusts clinical validation, so the advanced lipid-lock technology claim fits their trust pattern without being completely unquestioned."
Concept 2: Dove Skip,M8_q30,How well does the Dove Skip idea fit with what you expect from the Dove brand?,very,Fits very well,"Previous answers show the twin feels Dove fits well with innovative, skin-benefit focused products, so this concept aligns well with their expectations of the Dove brand."
Concept 2: Dove Skip,M8_q31,How would you describe the Dove Skip? Rate each pair of characteristics.,"{""Basic-Premium"": 4, ""Boring-Exciting"": 3, ""Not for me-Made for me"": 5, ""Old-fashioned-Innovative"": 4, ""Forgettable-Memorable"": 4}",Basic-Premium: 4; Boring-Exciting: 3; Not for me-Made for me: 5; Old-fashioned-Innovative: 4; Forgettable-Memorable: 4,"Participant appreciates Dove Skip for solving a real hassle with moisturizing during shower, values innovation and personal relevance but less excitement compared to 60-Second Spray."
Concept 2: Dove Skip,M8_q34,"What concerns, if any, would you have about trying the Dove Skip? Select all that apply.","[""skeptical_claims"", ""price_high""]",Might not work as claimed; Price might be too high,The twin values clinical proof and is price-sensitive; Dove Skip at Rs.349-599 is premium and the twin would worry if the advanced lipid-lock technology delivers as promised.
Concept 3: Dove Night Wash,M8_q35,"Overall, how interested are you in this product concept?",4,4,"The twin found the calming ritual aspect appealing but rated the Dove Night Wash as somewhat relevant and probably buy, indicating moderate to high interest."
Concept 3: Dove Night Wash,M8_q36,"What, if anything, did you find most appealing about the Dove Night Wash concept?","The calming ritual aspect with chamomile and lavender clinically shown to reduce stress is appealing, as I value products that offer both sensory and skin benefits.","The calming ritual aspect with chamomile and lavender clinically shown to reduce stress is appealing, as I value products that offer both sensory and skin benefits.","I appreciate aspirational, premium concepts with clinical validation and relaxing benefits, fitting my aspirational aesthetic seeker profile."
Concept 3: Dove Night Wash,M8_q37,"What, if anything, would you change or improve about the Dove Night Wash concept?","I would want the scent to be more distinctly masculine and less floral, and perhaps a stronger emphasis on skin benefits beyond relaxation to justify the price.","I would want the scent to be more distinctly masculine and less floral, and perhaps a stronger emphasis on skin benefits beyond relaxation to justify the price.","Masculine framing is important to me, and I am price-sensitive but willing to pay for proven benefits, so the concept should balance these."
Concept 3: Dove Night Wash,M8_q38,How well does the Dove Night Wash concept fit with your current routine?,3,3 (Somewhat well),"The twin rated the Dove Night Wash as somewhat fitting their routine, reflecting a moderate fit rather than an extremely well fit."
Concept 3: Dove Night Wash,M8_q40,"Based on what you've seen, how likely would you be to buy the Dove Night Wash?",probably_buy,Probably would buy,"The twin is open to trying new Dove concepts and values clinical benefits like stress reduction, but the night wash is less directly linked to their core skin concerns, leading to a probable but not definite purchase intent."
Concept 3: Dove Night Wash,M8_q42,How unique or different is the Dove Night Wash compared to other body wash products available today?,somewhat,Somewhat unique,"While the calming night shower concept with chamomile and lavender is somewhat different, it is less unique than the lipid-lock moisturizing innovation and fits a more common niche."
Concept 3: Dove Night Wash,M8_q43,How relevant is the Dove Night Wash to your personal needs?,somewhat,Somewhat relevant,"The twin values skin moisturization and clinical benefits but the night routine calming benefit is less of a personal priority, making it moderately relevant."
Concept 3: Dove Night Wash,M8_q44,How believable are the claims made about the Dove Night Wash?,very,Very believable,"The twin trusts clinical claims and ingredient-based benefits, so the scientifically supported stress hormone reduction claims are considered very believable."
Concept 3: Dove Night Wash,M8_q45,How well does the Dove Night Wash idea fit with what you expect from the Dove brand?,somewhat,Fits somewhat well,"Prior survey response rated Dove Night Wash as somewhat unique and somewhat relevant, indicating the concept fits Dove's brand but not perfectly aligned with highest expectations."
Concept 3: Dove Night Wash,M8_q46,How would you describe the Dove Night Wash? Rate each pair of characteristics.,"{""Basic-Premium"": 3, ""Boring-Exciting"": 3, ""Not for me-Made for me"": 3, ""Old-fashioned-Innovative"": 3, ""Forgettable-Memorable"": 3}",Basic-Premium: 3; Boring-Exciting: 3; Not for me-Made for me: 3; Old-fashioned-Innovative: 3; Forgettable-Memorable: 3,"Participant rates Dove Night Wash as somewhat relevant and somewhat fitting with routine, with moderate uniqueness and appeal, reflecting neutral to slightly positive ratings."
Concept 3: Dove Night Wash,M8_q49,"What concerns, if any, would you have about trying the Dove Night Wash? Select all that apply.","[""skeptical_claims"", ""price_high""]",Might not work as claimed; Price might be too high,The Dove Night Wash concept is somewhat relevant but the twin is cautious about whether the calming benefits truly work and finds Rs.299-499 a bit steep for a body wash.
Concept 4: Dove Yours & Mine,M8_q50,"Overall, how interested are you in this product concept?",4,4,"Participant finds the personalized fragrance quiz and emotional closeness aspect appealing but has only somewhat positive past interest (might_buy) and desires more masculine, premium fragrance options and better availability, so interest is high but not extreme."
Concept 4: Dove Yours & Mine,M8_q51,"What, if anything, did you find most appealing about the Dove Yours & Mine concept?",The personalized fragrance quiz and the idea of carrying a subtle trace of my partner's scent is very appealing as it connects to emotional closeness and aspirational grooming.,The personalized fragrance quiz and the idea of carrying a subtle trace of my partner's scent is very appealing as it connects to emotional closeness and aspirational grooming.,"I value aspirational social signaling and personal connection through scent, and the customization aspect fits my taste-conscious identity."
Concept 4: Dove Yours & Mine,M8_q52,"What, if anything, would you change or improve about the Dove Yours & Mine concept?","I would want the fragrance options to be more distinctly masculine and premium, with clearer information on the ingredients and skin benefits. Also, easier availability in stores like Nykaa and Blinkit would improve the concept.","I would want the fragrance options to be more distinctly masculine and premium, with clearer information on the ingredients and skin benefits. Also, easier availability in stores like Nykaa and Blinkit would improve the concept.","The twin values masculine, premium fragrances and ingredient transparency, and has expressed desire for better availability in preferred stores."
Concept 4: Dove Yours & Mine,M8_q55,"Based on what you've seen, how likely would you be to buy the Dove Yours & Mine?",might_buy,Might or might not buy,"While the personalized couples scent concept is aspirational and interesting, the premium price (₹799-999) and niche appeal make this twin cautious; no direct evidence shows strong purchase intent for this product."
Concept 4: Dove Yours & Mine,M8_q57,How unique or different is the Dove Yours & Mine compared to other body wash products available today?,very,Very unique,"The personalized fragrance quiz and couples kit concept is novel compared to typical body washes, fitting the twin's appreciation for innovative and aspirational products."
Concept 4: Dove Yours & Mine,M8_q58,How relevant is the Dove Yours & Mine to your personal needs?,somewhat,Somewhat relevant,The twin values scent and social signaling but prioritizes products addressing personal skin needs; a couples scent product is less directly relevant to his core skin concerns.
Concept 4: Dove Yours & Mine,M8_q59,How believable are the claims made about the Dove Yours & Mine?,very,Very believable,"The concept’s personalization and fragrance library are credible claims that align with the twin’s preference for products with clear, believable benefits."
Concept 4: Dove Yours & Mine,M8_q60,How well does the Dove Yours & Mine idea fit with what you expect from the Dove brand?,somewhat,Fits somewhat well,The aspirational and personalized nature fits Dove's evolving brand image somewhat well but is less core than Dove’s traditional focus on skin care and clinical benefits.
Concept 4: Dove Yours & Mine,M8_q61,How would you describe the Dove Yours & Mine? Rate each pair of characteristics.,"{""Basic-Premium"": 4, ""Boring-Exciting"": 4, ""Not for me-Made for me"": 4, ""Old-fashioned-Innovative"": 5, ""Forgettable-Memorable"": 4}",Basic-Premium: 4; Boring-Exciting: 4; Not for me-Made for me: 4; Old-fashioned-Innovative: 5; Forgettable-Memorable: 4,"Participant finds Dove Yours & Mine very unique and appealing for personalized fragrance and emotional connection, valuing innovation and aspirational premium feel."
Concept 4: Dove Yours & Mine,M8_q64,"What concerns, if any, would you have about trying the Dove Yours & Mine? Select all that apply.","[""price_high"", ""skeptical_claims""]",Price might be too high; Might not work as claimed,"At Rs.799-999 for a couples kit, the twin finds the price high and questions if the personalized fragrance quiz and scent connection claims will be effective."
Concept 5: Dove Skin ID,M8_q65,"Overall, how interested are you in this product concept?",5,5 (Extremely interested),"Participant previously rated interest in Dove Skin ID as probably_buy and extremely interested in uniqueness and relevance, valuing AI customization highly despite price concerns, so extremely interested fits best."
Concept 5: Dove Skin ID,M8_q66,"What, if anything, did you find most appealing about the Dove Skin ID concept?","The most appealing part is the AI skin analysis that customizes the body wash for my unique skin needs, which feels extremely relevant and innovative compared to other products.","The most appealing part is the AI skin analysis that customizes the body wash for my unique skin needs, which feels extremely relevant and innovative compared to other products.","The twin finds Dove Skin ID extremely unique and relevant, appreciating the AI customization feature as a strong differentiator."
Concept 5: Dove Skin ID,M8_q67,"What, if anything, would you change or improve about the Dove Skin ID concept?","I would want clearer proof of clinical validation to trust the AI claims, assurance it works well on Indian men's skin, and a slightly lower price or subscription option to make it more accessible.","I would want clearer proof of clinical validation to trust the AI claims, assurance it works well on Indian men's skin, and a slightly lower price or subscription option to make it more accessible.","The twin is skeptical about claims without clinical proof, concerned about price, and wants assurance on suitability for Indian men's skin."
Concept 5: Dove Skin ID,M8_q68,How well does the Dove Skin ID concept fit with your current routine?,5,5 (Extremely well),"Participant's routine involves daily body wash use and they see Dove Skin ID as extremely relevant and fitting well with their needs, so the concept fits extremely well with current routine."
Concept 5: Dove Skin ID,M8_q70,"Based on what you've seen, how likely would you be to buy the Dove Skin ID?",probably_buy,Probably would buy,"The twin is interested in clinically validated, personalized products and finds AI skin analysis interesting but would need product quality assurance before fully committing."
Concept 5: Dove Skin ID,M8_q72,How unique or different is the Dove Skin ID compared to other body wash products available today?,extremely,Extremely unique,"AI-driven custom body wash with photo analysis is a highly innovative concept unlike typical products, matching the twin’s openness to novel, clinically relevant innovations."
Concept 5: Dove Skin ID,M8_q73,How relevant is the Dove Skin ID to your personal needs?,extremely,Extremely relevant,"The twin finds Dove Skin ID extremely unique and values personalized, clinically validated products that address specific skin needs, matching their oily/acne-prone skin concerns and interest in AI skin analysis technology."
Concept 5: Dove Skin ID,M8_q74,How believable are the claims made about the Dove Skin ID?,very,Very believable,"The twin trusts credible claims and expert-backed ingredients; while intrigued by the AI feature, they remain cautiously optimistic, rating the claims as very believable but not completely without reservation."
Concept 5: Dove Skin ID,M8_q75,How well does the Dove Skin ID idea fit with what you expect from the Dove brand?,somewhat,Fits somewhat well,"The twin previously rated Dove Skin ID as extremely unique but only somewhat fitting with Dove's typical brand expectations, reflecting a perception that this high-tech personalized product is somewhat of a new direction for Dove."
Concept 5: Dove Skin ID,M8_q76,How would you describe the Dove Skin ID? Rate each pair of characteristics.,"{""Basic-Premium"": 5, ""Boring-Exciting"": 5, ""Not for me-Made for me"": 5, ""Old-fashioned-Innovative"": 5, ""Forgettable-Memorable"": 5}",Basic-Premium: 5; Boring-Exciting: 5; Not for me-Made for me: 5; Old-fashioned-Innovative: 5; Forgettable-Memorable: 5,"Participant rates Dove Skin ID extremely unique, very relevant, and fitting with routine, strongly valuing innovation, personalization, and premium positioning."
Concept 5: Dove Skin ID,M8_q79,"What concerns, if any, would you have about trying the Dove Skin ID? Select all that apply.","[""price_high"", ""skeptical_claims"", ""skin_irritation""]",Price might be too high; Might not work as claimed; Could irritate my skin,"The Dove Skin ID with AI skin analysis at Rs.699+ is interesting but expensive; the twin wants proof it works and is wary of potential skin irritation from a new, tech-driven product."
Comparative & Pricing,M8_q17,How important are each of these factors when choosing a body wash?,"{""Cleansing effectiveness"": 5, ""Moisturization / skin hydration"": 5, ""Fragrance / scent quality"": 5, ""Gentleness on skin"": 4, ""Value for money"": 5, ""Innovation / uniqueness"": 4, ""Brand trust and reputation"": 4, ""Convenience / ease of use"": 5}",Cleansing effectiveness: 5; Moisturization / skin hydration: 5; Fragrance / scent quality: 5; Gentleness on skin: 4; Value for money: 5; Innovation / uniqueness: 4; Brand trust and reputation: 4; Convenience / ease of use: 5,"Participant prioritizes cleansing, moisturization, fragrance, value, and convenience highly, with moderate to high importance on gentleness, innovation, and brand trust."
Comparative & Pricing,M8_q80,"Now that you've seen all 5 concepts, please rank them from most to least appealing. Pick your top 3.","[""Dove 60-Second Body Spray"", ""Dove Skip"", ""Dove Skin ID"", ""Dove Night Wash"", ""Dove Yours & Mine""]",Dove 60-Second Body Spray > Dove Skip > Dove Skin ID > Dove Night Wash > Dove Yours & Mine,"The Dove 60-Second Body Spray and Dove Skip concepts were rated highest in appeal and relevance, with Dove Skin ID also rated very high for uniqueness and innovation; Dove Night Wash and Yours & Mine were less preferred due to moderate appeal and some concerns about scent and masculinity."
