Section,Question ID,Question,Answer (Value),Answer (Label),Reasoning
Category Screening,M8_q01,How often do you personally use body wash or shower gel?,daily,Daily,Real evidence states the participant showers once daily and uses body wash mainly.
Category Screening,M8_q02,Which body wash or shower gel brands have you used in the past 3 months? Select all that apply.,"[""dove"", ""lux"", ""other""]",Dove; Lux; Other brand,"Real interview evidence lists Lux, Dove, Baylis & Harding as current brands used; Baylis & Harding is not an option, so 'Other brand' covers it."
Category Screening,M8_q03,"Overall, how satisfied are you with the body wash or shower gel you currently use most often?",somewhat_satisfied,Somewhat satisfied,"Participant finds current body wash 'mediocre' and wants a better sensitive-skin option, indicating moderate satisfaction."
Category Screening,M8_q04,"What, if anything, would you most like to see improved in body wash or shower gel products?","I would like body washes to have more natural, gentle ingredients that are safe for sensitive skin and a pleasant floral or lavender scent that feels refreshing without being overpowering.","I would like body washes to have more natural, gentle ingredients that are safe for sensitive skin and a pleasant floral or lavender scent that feels refreshing without being overpowering.","The twin values natural/Ayurvedic ingredients, gentle formulas for sensitive skin, and floral/lavender scents as key product improvements."
Concept 1: Dove 60-Second Body Spray,M8_q05,"Overall, how interested are you in this product concept?",2,2,Prior answers show low interest in Dove 60-Second Body Spray due to price concerns and skepticism despite convenience appeal.
Concept 1: Dove 60-Second Body Spray,M8_q06,"What, if anything, did you find most appealing about the Dove 60-Second Body Spray concept?","The most appealing part was the promise of getting completely clean in just 60 seconds, which sounds convenient for busy days when I have little time for a full shower.","The most appealing part was the promise of getting completely clean in just 60 seconds, which sounds convenient for busy days when I have little time for a full shower.",The twin appreciates practical benefits like speed and efficiency but remains skeptical about new claims; the fast cleaning benefit aligns with their pragmatic problem-solver trait.
Concept 1: Dove 60-Second Body Spray,M8_q07,"What, if anything, would you change or improve about the Dove 60-Second Body Spray concept?","I would improve the concept by ensuring it clearly states the formula is gentle and safe for sensitive skin, preferably with Ayurvedic or dermatologist endorsement, and by lowering the price to make it more accessible.","I would improve the concept by ensuring it clearly states the formula is gentle and safe for sensitive skin, preferably with Ayurvedic or dermatologist endorsement, and by lowering the price to make it more accessible.","Concerns about price, skin irritation, and distrust of new products were noted; adding trusted certifications and better pricing would address these."
Concept 1: Dove 60-Second Body Spray,M8_q08,How well does the Dove 60-Second Body Spray concept fit with your current routine?,3,3 (Somewhat well),"Fits somewhat well with routine as a quick option, but not highly relevant or fully trusted per prior answers."
Concept 1: Dove 60-Second Body Spray,M8_q09,How likely would the Dove 60-Second Body Spray be to save you time in your routine?,3,3 (Moderately likely),"Moderately likely to save time as it promises 60-second cleaning, but doubts about efficacy reduce enthusiasm."
Concept 1: Dove 60-Second Body Spray,M8_q10,"Based on what you've seen, how likely would you be to buy the Dove 60-Second Body Spray?",probably_not,Probably would not buy,"The Dove 60-Second Body Spray's micellar technology and speed focus conflicts with the participant's preference for gentle, natural, and tested products; also, the concept is not aligned with their cautious, ingredient-first approach."
Concept 1: Dove 60-Second Body Spray,M8_q12,How unique or different is the Dove 60-Second Body Spray compared to other body wash products available today?,not_very,Not very unique,"The product's micellar cleansing technology is seen as marketing jargon and not a meaningful innovation for this pragmatic, risk-averse user."
Concept 1: Dove 60-Second Body Spray,M8_q13,How relevant is the Dove 60-Second Body Spray to your personal needs?,not_very,Not very relevant,Participant showers once daily and values gentle cleansing over speed; the 60-second speed benefit does not align with their personal needs.
Concept 1: Dove 60-Second Body Spray,M8_q14,How believable are the claims made about the Dove 60-Second Body Spray?,somewhat,Somewhat believable,Claims about micellar technology are somewhat believable but participant remains skeptical without dermatologist validation.
Concept 1: Dove 60-Second Body Spray,M8_q15,How well does the Dove 60-Second Body Spray idea fit with what you expect from the Dove brand?,somewhat,Fits somewhat well,"Dove is a trusted international brand for the participant, but the 60-second body spray concept is somewhat different from their usual expectations."
Concept 1: Dove 60-Second Body Spray,M8_q16,How would you describe the Dove 60-Second Body Spray? Rate each pair of characteristics.,"{""Basic-Premium"": 3, ""Boring-Exciting"": 3, ""Not for me-Made for me"": 2, ""Old-fashioned-Innovative"": 3, ""Forgettable-Memorable"": 2}",Basic-Premium: 3; Boring-Exciting: 3; Not for me-Made for me: 2; Old-fashioned-Innovative: 3; Forgettable-Memorable: 2,"Prior answers rate Dove 60-Second Body Spray as not very unique, somewhat fitting but not very relevant, with moderate believability; the concept is somewhat innovative but not exciting or memorable for this pragmatic, risk-averse user."
Concept 1: Dove 60-Second Body Spray,M8_q19,"What concerns, if any, would you have about trying the Dove 60-Second Body Spray? Select all that apply.","[""price_high"", ""skeptical_claims"", ""skin_irritation"", ""distrust_new"", ""happy_current""]",Price might be too high; Might not work as claimed; Could irritate my skin; Don't trust new products; Happy with current product,"The twin is very skeptical of new products due to sensitive skin, finds Dove 60-Second Body Spray not very unique or relevant, and price of Rs.199-399 is considered high for a trial; loyalty to current trusted brands and irritation concerns are key."
Concept 2: Dove Skip,M8_q20,"Overall, how interested are you in this product concept?",4,4,"Prior answers indicate strong appeal for Dove Skip moisturizing benefit and time-saving, though price is a concern."
Concept 2: Dove Skip,M8_q21,"What, if anything, did you find most appealing about the Dove Skip concept?","The most appealing aspect is the idea of moisturizing skin during the shower itself, which saves time and effort by eliminating the need for a separate lotion step.","The most appealing aspect is the idea of moisturizing skin during the shower itself, which saves time and effort by eliminating the need for a separate lotion step.",The twin values practical solutions that simplify routines and appreciates moisture benefits without extra hassle.
Concept 2: Dove Skip,M8_q22,"What, if anything, would you change or improve about the Dove Skip concept?","I would want clearer information on the ingredients to confirm they are natural and Ayurvedic, and a more affordable price point since ₹349-599 feels a bit high for a body wash.","I would want clearer information on the ingredients to confirm they are natural and Ayurvedic, and a more affordable price point since ₹349-599 feels a bit high for a body wash.","The twin prioritizes ingredient transparency and is price sensitive, especially for mid-range products."
Concept 2: Dove Skip,M8_q23,How well does the Dove Skip concept fit with your current routine?,3,3 (Somewhat well),Fits somewhat well with routine since moisturizing in-shower is convenient but price and ingredient clarity are issues.
Concept 2: Dove Skip,M8_q24,How likely would the Dove Skip be to save you time in your routine?,4,4,"Likely to save time by eliminating lotion step, which aligns with pragmatic problem-solving behavior."
Concept 2: Dove Skip,M8_q25,"Based on what you've seen, how likely would you be to buy the Dove Skip?",probably_buy,Probably would buy,"The Dove Skip's promise of 12-hour moisturized skin aligns with the participant's desire for moisturized post-wash skin and convenience, making it appealing though price is mid-premium."
Concept 2: Dove Skip,M8_q27,How unique or different is the Dove Skip compared to other body wash products available today?,somewhat,Somewhat unique,"The concept of moisturizing skin during the shower is somewhat different but not completely new; the twin is pragmatic and somewhat skeptical, so 'somewhat unique' fits their moderate acceptance of innovation."
Concept 2: Dove Skip,M8_q28,How relevant is the Dove Skip to your personal needs?,somewhat,Somewhat relevant,"The twin wants moisturized skin but is cautious about new claims; moisturizing during shower is relevant but not a strong personal need since they already use gentle, moisturizing body washes."
Concept 2: Dove Skip,M8_q29,How believable are the claims made about the Dove Skip?,somewhat,Somewhat believable,The twin is selectively trusting and requires dermatologist or Ayurvedic validation; 'somewhat believable' matches their moderate trust in Dove claims without full conviction.
Concept 2: Dove Skip,M8_q30,How well does the Dove Skip idea fit with what you expect from the Dove brand?,somewhat,Fits somewhat well,"Prior answers show Dove fits somewhat well with expectations; this product's moisturizing claim aligns with Dove's gentle image but is not a perfect fit for the twin's pragmatic, ingredient-focused mindset."
Concept 2: Dove Skip,M8_q31,How would you describe the Dove Skip? Rate each pair of characteristics.,"{""Basic-Premium"": 3, ""Boring-Exciting"": 3, ""Not for me-Made for me"": 4, ""Old-fashioned-Innovative"": 4, ""Forgettable-Memorable"": 3}",Basic-Premium: 3; Boring-Exciting: 3; Not for me-Made for me: 4; Old-fashioned-Innovative: 4; Forgettable-Memorable: 3,"The Dove Skip concept was rated somewhat unique and relevant, with appeal for moisturizing during shower and saving time, but price concerns lower premium perception; innovation and fit to routine scored moderately high."
Concept 2: Dove Skip,M8_q34,"What concerns, if any, would you have about trying the Dove Skip? Select all that apply.","[""price_high"", ""skeptical_claims"", ""skin_irritation"", ""happy_current""]",Price might be too high; Might not work as claimed; Could irritate my skin; Happy with current product,"Twin finds Dove Skip somewhat unique and somewhat likely to buy but price at Rs.349-599 is high; sensitive skin and irritation concerns apply, and loyalty to current products means satisfaction with current brand."
Concept 3: Dove Night Wash,M8_q35,"Overall, how interested are you in this product concept?",5,5 (Extremely interested),Very interested in Dove Night Wash due to its calming lavender/chamomile scent and stress-relief positioning.
Concept 3: Dove Night Wash,M8_q36,"What, if anything, did you find most appealing about the Dove Night Wash concept?","I like that it offers a calming, relaxing shower experience with lavender and chamomile, which helps me unwind after a stressful day.","I like that it offers a calming, relaxing shower experience with lavender and chamomile, which helps me unwind after a stressful day.",The twin is a stress-triggered comfort seeker who values lavender and floral scents for relaxation and mood improvement.
Concept 3: Dove Night Wash,M8_q37,"What, if anything, would you change or improve about the Dove Night Wash concept?","I would improve it by emphasizing Ayurvedic certification or dermatologist testing to build trust, and possibly offering a slightly larger size at a better value for money.","I would improve it by emphasizing Ayurvedic certification or dermatologist testing to build trust, and possibly offering a slightly larger size at a better value for money.","Trust in Ayurvedic claims and dermatologist validation is important, and price/value sensitivity is consistent with the twin's pragmatic orientation."
Concept 3: Dove Night Wash,M8_q38,How well does the Dove Night Wash concept fit with your current routine?,4,4,"Fits well with current routine as evening relaxation is valued, though not rated extremely well possibly due to price."
Concept 3: Dove Night Wash,M8_q40,"Based on what you've seen, how likely would you be to buy the Dove Night Wash?",probably_buy,Probably would buy,"The twin is a stress-triggered comfort seeker who values lavender and floral scents and would appreciate a calming night shower product with chamomile and lavender, making purchase likely."
Concept 3: Dove Night Wash,M8_q42,How unique or different is the Dove Night Wash compared to other body wash products available today?,somewhat,Somewhat unique,"A night-specific body wash with stress-relief benefits is somewhat unique compared to regular body washes, fitting the twin's moderate openness to mood-related product differentiation."
Concept 3: Dove Night Wash,M8_q43,How relevant is the Dove Night Wash to your personal needs?,very,Very relevant,"The twin values stress relief and relaxation in personal care, so a calming night wash with lavender and chamomile is highly relevant to their needs."
Concept 3: Dove Night Wash,M8_q44,How believable are the claims made about the Dove Night Wash?,very,Very believable,"Claims backed by clinical studies on lavender and chamomile align with the twin's need for credible, dermatologist-like validation, making the claims very believable."
Concept 3: Dove Night Wash,M8_q45,How well does the Dove Night Wash idea fit with what you expect from the Dove brand?,very,Fits very well,"Prior answer rated Dove Night Wash claims as very believable and very relevant; the calming, lavender-chamomile night ritual fits Dove's gentle, trusted brand image well."
Concept 3: Dove Night Wash,M8_q46,How would you describe the Dove Night Wash? Rate each pair of characteristics.,"{""Basic-Premium"": 4, ""Boring-Exciting"": 4, ""Not for me-Made for me"": 5, ""Old-fashioned-Innovative"": 4, ""Forgettable-Memorable"": 4}",Basic-Premium: 4; Boring-Exciting: 4; Not for me-Made for me: 5; Old-fashioned-Innovative: 4; Forgettable-Memorable: 4,"Dove Night Wash is very relevant and believable with calming benefits, fitting well with routine; the twin appreciates its lavender-chamomile scent and relaxing positioning, rating it more premium and memorable."
Concept 3: Dove Night Wash,M8_q49,"What concerns, if any, would you have about trying the Dove Night Wash? Select all that apply.","[""happy_current"", ""no_concerns""]",Happy with current product; No concerns,"Twin rates Dove Night Wash very relevant, very believable, and very fitting with expectations, indicating high trust and satisfaction, so no major concerns except contentment with current product."
Concept 4: Dove Yours & Mine,M8_q50,"Overall, how interested are you in this product concept?",2,2,Participant expressed limited interest in Dove Yours & Mine due to high price and preference for familiar scents over personalized formulas.
Concept 4: Dove Yours & Mine,M8_q51,"What, if anything, did you find most appealing about the Dove Yours & Mine concept?","The idea of feeling connected to my partner through scent is interesting, but I find the price too high and would prefer to stick to scents I know and trust for myself rather than personalized formulas.","The idea of feeling connected to my partner through scent is interesting, but I find the price too high and would prefer to stick to scents I know and trust for myself rather than personalized formulas.","The twin is self-oriented in grooming, skeptical of new scents, and views premium gift sets as overpriced for personal use."
Concept 4: Dove Yours & Mine,M8_q52,"What, if anything, would you change or improve about the Dove Yours & Mine concept?","I would lower the price significantly and focus more on familiar, trusted scents like lavender and mogra rather than personalized formulas, as I prefer to stick with what I know works for my sensitive skin.","I would lower the price significantly and focus more on familiar, trusted scents like lavender and mogra rather than personalized formulas, as I prefer to stick with what I know works for my sensitive skin.","Participant finds the concept interesting but price too high and prefers trusted scents over personalized ones, consistent with prior answers rejecting premium pricing and novelty."
Concept 4: Dove Yours & Mine,M8_q55,"Based on what you've seen, how likely would you be to buy the Dove Yours & Mine?",probably_not,Probably would not buy,"The concept of a couples' personalized scent kit at a premium price (₹799-999) conflicts with the twin's pragmatic, risk-averse, and self-oriented grooming style; also, gifting premium sets is seen as overpriced and irrelevant for personal use."
Concept 4: Dove Yours & Mine,M8_q57,How unique or different is the Dove Yours & Mine compared to other body wash products available today?,not_very,Not very unique,"The personalized scent concept is somewhat novel but not aligned with the twin's preference for familiar, trusted scents and straightforward products; also, similar products exist, so uniqueness is limited."
Concept 4: Dove Yours & Mine,M8_q58,How relevant is the Dove Yours & Mine to your personal needs?,not_very,Not very relevant,Twin prioritizes personal comfort and familiar scents over partner-influenced or relationship-based products; the concept is not aligned with her pragmatic self-orientation.
Concept 4: Dove Yours & Mine,M8_q59,How believable are the claims made about the Dove Yours & Mine?,somewhat,Somewhat believable,"Twin is selectively trusting but skeptical of marketing claims, especially for novel personalized fragrance tech; she would require strong proof, which is not clearly provided here."
Concept 4: Dove Yours & Mine,M8_q60,How well does the Dove Yours & Mine idea fit with what you expect from the Dove brand?,not_very,Doesn't fit very well,"The Dove Yours & Mine concept is more aspirational and lifestyle-oriented, which the twin finds disconnected from her real-life pragmatic grooming needs and trusted Dove brand expectations."
Concept 4: Dove Yours & Mine,M8_q61,How would you describe the Dove Yours & Mine? Rate each pair of characteristics.,"{""Basic-Premium"": 4, ""Boring-Exciting"": 2, ""Not for me-Made for me"": 2, ""Old-fashioned-Innovative"": 4, ""Forgettable-Memorable"": 2}",Basic-Premium: 4; Boring-Exciting: 2; Not for me-Made for me: 2; Old-fashioned-Innovative: 4; Forgettable-Memorable: 2,"The Dove Yours & Mine concept is seen as overpriced and not very relevant; while innovative in personalization, the twin prefers familiar scents and finds it less made-for-me and somewhat boring."
Concept 4: Dove Yours & Mine,M8_q64,"What concerns, if any, would you have about trying the Dove Yours & Mine? Select all that apply.","[""price_high"", ""skeptical_claims"", ""skin_irritation"", ""distrust_new""]",Price might be too high; Might not work as claimed; Could irritate my skin; Don't trust new products,"Twin is skeptical of aspirational or premium concepts like Dove Yours & Mine priced at Rs.799-999, finds it not very unique or relevant, and prioritizes personal scent preference over partner's, plus sensitive skin concerns."
Concept 5: Dove Skin ID,M8_q65,"Overall, how interested are you in this product concept?",2,2,Participant is somewhat interested in Dove Skin ID concept because it addresses sensitive skin with dermatologist endorsement but is concerned about price and AI photo upload privacy.
Concept 5: Dove Skin ID,M8_q66,"What, if anything, did you find most appealing about the Dove Skin ID concept?","The idea of a body wash tailored to my specific skin needs sounds appealing, especially if it can address sensitive skin issues effectively with dermatologist endorsement.","The idea of a body wash tailored to my specific skin needs sounds appealing, especially if it can address sensitive skin issues effectively with dermatologist endorsement.","Participant values customization relevant to sensitive skin but is skeptical of new brands and tech, so dermatologist validation is key to appeal."
Concept 5: Dove Skin ID,M8_q67,"What, if anything, would you change or improve about the Dove Skin ID concept?","I would remove the AI photo upload requirement as it feels invasive and risky for my privacy, lower the price to under ₹500, and ensure the formula is clearly Ayurvedic and dermatologist-tested to build trust.","I would remove the AI photo upload requirement as it feels invasive and risky for my privacy, lower the price to under ₹500, and ensure the formula is clearly Ayurvedic and dermatologist-tested to build trust.","Participant strongly dislikes uploading skin photos to unknown brands and is price-sensitive, demanding Ayurvedic and dermatologist backing to consider new products."
Concept 5: Dove Skin ID,M8_q68,How well does the Dove Skin ID concept fit with your current routine?,3,3 (Somewhat well),"The Dove Skin ID concept fits somewhat well with the participant's routine as it targets sensitive skin needs, but concerns about invasiveness and price reduce full integration."
Concept 5: Dove Skin ID,M8_q70,"Based on what you've seen, how likely would you be to buy the Dove Skin ID?",probably_not,Probably would not buy,Twin is extremely risk-averse to new brands and tech-driven customization (AI skin analysis) especially at a premium price (₹699); she finds such features invasive and gimmicky despite the promise of customization.
Concept 5: Dove Skin ID,M8_q72,How unique or different is the Dove Skin ID compared to other body wash products available today?,somewhat,Somewhat unique,"AI-customized body wash is a novel concept in the market, but the twin is skeptical and cautious, so uniqueness is acknowledged but tempered by distrust and risk aversion."
Concept 5: Dove Skin ID,M8_q73,How relevant is the Dove Skin ID to your personal needs?,somewhat,Somewhat relevant,"Direct evidence rates Dove Skin ID as 'somewhat unique' and earlier survey answers show moderate relevance to personal needs, combined with strong risk aversion to AI photo uploads and high price reduces perceived relevance."
Concept 5: Dove Skin ID,M8_q74,How believable are the claims made about the Dove Skin ID?,somewhat,Somewhat believable,"Prior answers indicate moderate belief in Dove Skin ID claims, but skepticism toward AI skin analysis technology and high price for an unknown tech feature lowers full credibility."
Concept 5: Dove Skin ID,M8_q75,How well does the Dove Skin ID idea fit with what you expect from the Dove brand?,somewhat,Fits somewhat well,"Earlier survey responses show Dove Skin ID fits 'somewhat' with brand expectations, reflecting moderate alignment but tempered by the high-tech approach which is less typical for Dove's usual trusted, gentle image."
Concept 5: Dove Skin ID,M8_q76,How would you describe the Dove Skin ID? Rate each pair of characteristics.,"{""Basic-Premium"": 4, ""Boring-Exciting"": 3, ""Not for me-Made for me"": 3, ""Old-fashioned-Innovative"": 4, ""Forgettable-Memorable"": 3}",Basic-Premium: 4; Boring-Exciting: 3; Not for me-Made for me: 3; Old-fashioned-Innovative: 4; Forgettable-Memorable: 3,"Dove Skin ID is somewhat unique and relevant, with appeal for tailored skin needs and dermatologist endorsement; the twin finds it innovative but has privacy and price concerns, resulting in neutral to slightly positive ratings."
Concept 5: Dove Skin ID,M8_q79,"What concerns, if any, would you have about trying the Dove Skin ID? Select all that apply.","[""price_high"", ""skeptical_claims"", ""skin_irritation"", ""distrust_new""]",Price might be too high; Might not work as claimed; Could irritate my skin; Don't trust new products,"Twin is highly risk-averse to new brands and tech-heavy concepts like Dove Skin ID at Rs.699+, finds it somewhat unique but not very relevant or likely to buy, and worries about irritation and trust."
Comparative & Pricing,M8_q17,How important are each of these factors when choosing a body wash?,"{""Cleansing effectiveness"": 5, ""Moisturization / skin hydration"": 5, ""Fragrance / scent quality"": 5, ""Gentleness on skin"": 5, ""Value for money"": 5, ""Innovation / uniqueness"": 3, ""Brand trust and reputation"": 5, ""Convenience / ease of use"": 4}",Cleansing effectiveness: 5; Moisturization / skin hydration: 5; Fragrance / scent quality: 5; Gentleness on skin: 5; Value for money: 5; Innovation / uniqueness: 3; Brand trust and reputation: 5; Convenience / ease of use: 4,"The twin prioritizes cleansing, moisturization, fragrance, gentleness, value, and brand trust very highly due to sensitive skin and pragmatic needs; innovation is moderately important, convenience somewhat important."
Comparative & Pricing,M8_q80,"Now that you've seen all 5 concepts, please rank them from most to least appealing. Pick your top 3.","[""Dove Night Wash"", ""Dove Skip"", ""Dove 60-Second Body Spray"", ""Dove Skin ID"", ""Dove Yours & Mine""]",Dove Night Wash > Dove Skip > Dove 60-Second Body Spray > Dove Skin ID > Dove Yours & Mine,"The Dove Night Wash ranks highest due to its strong appeal as a relaxing, lavender-scented, Ayurvedic-endorsed product fitting sensitive skin needs; Dove Skip is next for its moisturizing convenience and somewhat unique positioning; Dove 60-Second Body Spray is less relevant and trusted but appreciated for convenience; Dove Skin ID and Yours & Mine rank lowest due to concerns about price, privacy, and lack of trust despite some interest."
